Timestamp,Age Range,Gender,Degree,Major,Minor/Specialization,Status,Graduation Date,Activity,Availability,Job Title,Employment Types,City,Province/State,Country,Industries,Functions,Experience Level,Hard Skills,Soft Skills
2/18/2019 14:45:26,15-25,Female,Bachelor of Engineering,Computer Engineering,,Graduated,,Actively looking,Immediately,Programmer Analyst,"Full-Time, Part-Time, Permanent, Temporary, Casual, On-call, Volunteering",Ottawa,Ontario,Canada,"Professional, Scientific, and Technical Services","Construction, Works, Engineering, Information & Communications Technology, Science, Technical Research & Development",Entry,"JavaScript, HTML, MySQL","teamwork, time management, communication"
2/18/2019 21:11:10,15-25,Female,Master of Applied Science,Computer Engineering,Data Science,Student,8/30/2019,Casually looking,Immediately,Data Scientist,"Full-Time, Part-Time, Permanent, Temporary, Casual",Ottawa,Ontario,Canada,"Professional, Scientific, and Technical Services, Health Care and Social Assistance","Science, Technical Research & Development",Intermediate,"C, MATLAB, research","willingness to learn, communication, leadership"
2/18/2019 21:23:34,40-60,Male,Doctor of Philosophy,Mathematics,,Employed,,Not looking,,Data Analyst,"Full-Time, Part-Time",Ottawa,Ontario,Canada,Education Services,"Education, Curriculum & Teaching, Consulting & Advising",Professional,"mathematics, statistics, data analysis","teamwork, leadership, writing"
2/18/2019 21:40:55,15-25,Female,Bachelor of Engineering,Computer Engineering,,Student,12/20/2019,Actively looking,In a year,Business Analyst,"Full-Time, Part-Time",Ottawa,Ontario,Canada,"Agriculture, Forestry, Fishing, and Hunting, Mining, Construction, Manufacturing, Utilities, Transportation and Warehousing, Wholesale Trade, Retail Trade, Accommodation and Food Services, Finance and Insurance, Real Estate, Rental, and Leasing, Information, Professional, Scientific, and Technical Services, Administrative, Support, Waste Management, and Remediation Services, Education Services, Health Care and Social Assistance, Arts, Entertainment, and Recreation, Public Administration, Management of Companies and Enterprises","HR, Training & Organisational Development, Sales & Marketing, Analytics",Entry,"SQL, Java, DBMS","teamwork, communication, leadership"
2/18/2019 21:48:17,15-25,Female,Bachelor of Engineering,Chemical Engineering,Engineering Management,Student,8/20/2020,Casually looking,In a year,Chemist,"Full-Time, Part-Time, Permanent",Ottawa,Ontario,Canada,Education Services,"Science, Technical Research & Development",Entry,"HYSYS, MATLAB, Microsoft Office ","teamwork, leadership, communication"
2/18/2019 21:54:46,15-25,Male,Master of Applied Science,Chemical Engineering,,Student,5/31/2020,Casually looking,In a year,Research Assistant,Full-Time,Ottawa,Ontario,Canada,"Professional, Scientific, and Technical Services","Science, Technical Research & Development",Entry,"HYSYS, MATLAB, Microsoft Office","adaptability, creativity, communication"
2/18/2019 22:13:42,25-40,Female,Bachelor of Arts,International Development and Relations,,Employed,,Not looking,,Project Manager,"Full-Time, Permanent",Ottawa,Ontario,Canada,Education Services,"Education, Curriculum & Teaching, Planning / Policy / Strategy, Projects & Programs",Professional,"project management, partnership development, designing new initiatives","leadership, mentorship, supportive"
2/18/2019 22:27:41,15-25,Female,Master of Business Administration,Business Analytics,,Student,12/20/2019,Actively looking,In 3 months,Coordinator,Full-Time,Ottawa,Ontario,Canada,"Professional, Scientific, and Technical Services, Arts, Entertainment, and Recreation","HR, Training & Organisational Development, Sales & Marketing, Travel / Accommodation / Tourism",Internship,"Microsoft Office, translation, project management","teamwork, communication, time management"
2/18/2019 22:45:40,25-40,Male,Master of Business Administration,Business Analytics,,Student,2/6/2020,Actively looking,In a month,Business Consultant,"Full-Time, Part-Time, Temporary",Ottawa,Ontario,Canada,"Professional, Scientific, and Technical Services","Administration / Office, Business / Corporate Services, Consulting & Advising, Science, Technical Research & Development",Professional,"Java/JavaScript, SFDC, development/consulting/administration","teamwork, communication, global sense"
2/19/2019 8:27:59,25-40,Female,Master of Business Administration,Business Analytics,Other,Employed,,Not looking,,Business Manager,Full-Time,Ottawa,Ontario,Canada,"Mining, Manufacturing, Information, Professional, Scientific, and Technical Services, Administrative, Support, Waste Management, and Remediation Services, Sustainability","Administration / Office, Business / Corporate Services, Client / Customer Services, Environment, Conservation & NRM, Science, Technical Research & Development",Intermediate,"auditing, attention to detail, management","optimism, responsibility"
2/19/2019 9:16:54,25-40,Female,Bachelor of Science in Electrical Engineering,Electrical Engineering,,Employed,,Casually looking,Immediately,Manager,Full-Time,Ottawa,Ontario,Canada,"Professional, Scientific, and Technical Services, Management of Companies and Enterprises","Management, Projects & Programs",Intermediate,"Coding, network configuration, data analysis","Leadership, management, teamwork"
2/19/2019 13:15:44,15-25,Female,Master of Business,Business Administration and Management,Other,Student,9/10/2019,Actively looking,Immediately,HR Consultant,Full-Time,Dublin,California,China,Utilities,Consulting & Advising,Internship,"English, Chinese, ps","Teamwork, communication, leadership "
2/19/2019 13:48:55,15-25,Female,Master of Business Administration,Finance,Business,Student,12/20/2019,Actively looking,Immediately,Accounting Manager,Full-Time,Seattle,Ontario,Canada,"Finance and Insurance, Real Estate, Rental, and Leasing, Management of Companies and Enterprises","Administration / Office, Finance Management, Information Services, Statistics, Records, Archives, Management, Member of Parliament, Consulting & Advising, Property, Assets & Fleet Management, Purchasing & Procurement, Travel / Accommodation / Tourism",Co-op,"Language, software tools","teamwork, communication, approachable"
2/19/2019 15:04:39,15-25,Female,Master of Business Administration,Finance,Economics,Employed,,Actively looking,Immediately,Analyst,Full-Time,Abu Dhabi,Ontario,Canada,"Retail Trade, Finance and Insurance","Business / Corporate Services, Client / Customer Services",Intermediate,Analytics,"Teamwork, communication, interpersonal "
2/19/2019 15:10:54,15-25,Female,Bachelor of Economics,Business Administration and Management,,Student,12/22/2019,Actively looking,In a year,Business Analyst,"Full-Time, Permanent",Ottawa,Ontario,Canada,"Finance and Insurance, Management of Companies and Enterprises","Administration / Office, Business / Corporate Services, Education, Curriculum & Teaching, Finance Management, Librarians & Library Management, Management, OH & S, Risk Management, Operations Management, Planning / Policy / Strategy, Sales & Marketing",Internship,"MS Office, Accounting, Finance","team work, communication, leadership"
2/19/2019 15:11:28,15-25,Female,Master of Science in Finance,Accounting,Business,Not Employed,7/1/2019,Casually looking,In a week,Accountant,Full-Time,Beverly Hills,Pennsylvania,Australia,"Retail Trade, Accommodation and Food Services, Finance and Insurance, Real Estate, Rental, and Leasing",Finance Management,Internship,,
2/19/2019 17:21:54,15-25,Female,Bachelor of Science in Industrial Engineering,Accounting,Business,Student,,Casually looking,In a week,Business Consultant,Part-Time,Baltimore,,Canada,"Finance and Insurance, Management of Companies and Enterprises","Administration / Office, Business / Corporate Services, Finance Management",Internship,project management,interpersonal skills
2/19/2019 19:40:49,15-25,Female,Master of Finance,Finance,,Student,12/31/2019,Actively looking,In 10 months,Financial Analyst,"Full-Time, Summer Internship",Toronto,Ontario,Canada,Finance and Insurance,"Business / Corporate Services, Finance Management, OH & S, Risk Management",Professional,"R, VBA, MATLAB","Teamwork, Communication, Leadership"
2/20/2019 8:09:28,25-40,Male,Bachelor of Education,Religious Studies,,Graduated,,Casually looking,In a month,Manager,"Full-Time, Permanent",Ottawa,Ontario,Canada,"Information, Education Services, Arts, Entertainment, and Recreation, Management of Companies and Enterprises","Administration / Office, Arts & Culture, Client / Customer Services, Communications, Community and Social Services, HR, Training & Organisational Development, Planning / Policy / Strategy, Printing, Design, Publishing, Web, Projects & Programs, Consulting & Advising, Public Relations & Media, Quality Management, Sales & Marketing, Sport & Recreation",Intermediate,"Program Development, Networking, Data Management ","Interpersonal Management, Leasership, Creativity"
2/21/2019 19:57:08,15-25,Female,Master of Business Administration,Business Analytics,Business,Student,12/20/2019,Actively looking,In 2 months,Business Analyst,"Full-Time, Volunteering",Ottawa,Ontario,Canada,"Finance and Insurance, Education Services, Management of Companies and Enterprises","Administration / Office, Business / Corporate Services, HR, Training & Organisational Development, Operations Management",Internship,"language, project management, Microsoft","communication, adaptability, time management"
2/24/2019 10:39:12,25-40,Male,Master of Science,Computer Science,,Employed,,Not looking,,Security Guard,Full-Time,Toronto,Ontario,Canada,Information,"Information & Communications Technology, Security & Law Enforcement",Senior,"systems programming, security analysis, linux","management, time management, quick learning"
2/25/2019 7:50:31,25-40,Male,Master of Economics,Economics,,Employed,,Casually looking,In a month,Data Analyst,Full-Time,Ottawa,Ontario,Canada,"Information, Professional, Scientific, and Technical Services, Education Services, Health Care and Social Assistance, Public Administration","Information & Communications Technology, Information Services, Statistics, Records, Archives, Planning / Policy / Strategy, Projects & Programs, Consulting & Advising, Science, Technical Research & Development",Senior,"Programming, research, project management","teamwork, easygoing, engaged"
2/28/2019 20:52:12,25-40,Male,Bachelor of Economics,Economics,Mathematics,Student,12/27/2019,Actively looking,In 2 months,Business Analyst,"Full-Time, Casual, Volunteering",Ottawa,Ontario,Canada,"Finance and Insurance, Real Estate, Rental, and Leasing, Information, Professional, Scientific, and Technical Services","Information & Communications Technology, Management, OH & S, Risk Management, Consulting & Advising",Intermediate,"Project management, Python, R","Team work, Coaching, Relationship Building"
3/2/2019 14:40:30,15-25,Female,Secondary School Diploma,N/A,,Student,6/28/2019,Not looking,,Nurse,"Full-Time, Permanent",Ottawa,Ontario,Canada,Health Care and Social Assistance,Health - Medical & Nursing Management,Co-op,"Math, project management, fit for moving around","Leadership, responsible, punctual "
3/2/2019 14:53:18,15-25,Female,Other,"Hotel, Restaurant, and Institutional Management",,Student,4/30/2019,Not looking,,Event Planner,Full-Time,Ottawa,Ontario,Canada,hospitality,"Management, hospitality management",Entry,taking initiative,teamwork
3/2/2019 15:30:48,15-25,Female,Bachelor,Early Learning and Community Development,,"Student, Employed",4/30/2020,Not looking,,Teacher,Part-Time,Ottawa,Ontario,Canada,Education Services,"Education, Curriculum & Teaching",Entry,"Observant, creative, and punctual","Respectful, honest, and inclusive"
3/2/2019 23:54:16,25-40,Male,Bachelor of Science in Information Systems,Information Sciences and Technology,,Employed,,Casually looking,In 2 weeks,IT Project Manager,"Full-Time, Permanent",Ottawa,,Canada,"Finance and Insurance, Professional, Scientific, and Technical Services, Administrative, Support, Waste Management, and Remediation Services, Management of Companies and Enterprises","Administration / Office, Board Member, Business / Corporate Services, Finance Management, HR, Training & Organisational Development, Information & Communications Technology, Management",Senior,"Networking, Server Management, Virtual Machines, SQL language, Data Management, Office 365, Computer Hardware Repairs, Systems Administrator, Network Administrator, IT Project Management, Active Directory, Spam Filter, Microsoft Office, Dynamic Reports, ERP Administrator. Software Installation, Computer Hardware Deployment, Computer Hardware/Software Purchasing","Team Work, Leadership, Problem Solving, Communication, Time Management, Hardwork, Organization,  "
3/3/2019 0:02:29,40-60,Male,Bachelor of Science in Computer Engineering,Mathematics,,Employed,,Not looking,,Engineer,"Full-Time, Permanent",Ottawa,Ontario,Canada,"Professional, Scientific, and Technical Services","Science, Technical Research & Development",Senior,"Security, cryptography, c language","Technical communication, presentation and documentation "
3/3/2019 1:10:34,40-60,Female,Associate Degree in Library Science,Information Sciences and Technology,Other,"Student, Not Employed",5/30/2019,Actively looking,In 3 months ,Library Assistant,Full-Time,Ottawa,Ontario,Canada,Information,"Administration / Office, Client / Customer Services, Community and Social Services, Information Services, Statistics, Records, Archives, Librarians & Library Management",Internship,"Cataloging, Research, information management ","Communication, customer service, detail oriented"
3/4/2019 21:21:21,15-25,Female,Secondary School Diploma,Other,,"Student, Employed",4/30/2020,Casually looking,In a year,Administrative Assistant,"Full-Time, Permanent",Oulu,Campeche,Canada,"Accommodation and Food Services, Finance and Insurance, Real Estate, Rental, and Leasing, Administrative, Support, Waste Management, and Remediation Services, Health Care and Social Assistance, Public Administration",Administration / Office,Entry,"Microsoft, filing, bookings","Organization, communication"
3/5/2019 0:35:09,15-25,Female,Secondary School Diploma,Nursing,,"Student, Employed",6/1/2020,Casually looking,In 2 months,Nursing Assistant,"Full-Time, Part-Time, Permanent, Temporary, Casual, On-call, Volunteering",Ottawa,Ontario,Canada,Health Care and Social Assistance,Health - Medical & Nursing Management,Co-op,"Assessing patients, administering medications, developing plans of care ","Communication, teamwork, caring "
3/8/2019 8:27:34,25-40,Male,Master of Business Administration,Business Analytics,,Student,12/30/2019,Actively looking,In 2 months,Business Analyst,Full-Time,Ottawa,Ontario,Canada,"Construction, Utilities, Wholesale Trade, Real Estate, Rental, and Leasing, Information, Professional, Scientific, and Technical Services, Management of Companies and Enterprises","Business / Corporate Services, Finance Management, Infrastructure Management - Transport, Utilities, Management, Operations Management, Planning / Policy / Strategy, Projects & Programs, Consulting & Advising, Property, Assets & Fleet Management, Purchasing & Procurement, Sales & Marketing",Entry,"Project Management, Financial Management, Data Visualization","communication, leadership, sales"
